{
  "schema_version": 1,
  "source_of_truth": "crates/mahjong-core/src/winning_hand/name.rs",
  "english_names": {
    "source": "World Riichi Championship Rules 2025, §11.5 / §13.3",
    "url": "https://www.worldriichi.org/s/WRC-Rules-2025-42fx.pdf"
  },
  "open_suffix": {
    "en": " (Open)",
    "ja": "（鳴）"
  },
  "yaku": [
    {
      "kind": "Riichi",
      "en": "Riichi",
      "ja": "立直",
      "romaji": "Riichi",
      "mjai": "reach",
      "closed_only": true,
      "open_en": null,
      "open_ja": null,
      "value": { "unit": "han", "closed": 1, "open": null }
    },
    {
      "kind": "DoubleRiichi",
      "en": "Double Riichi",
      "ja": "ダブル立直",
      "romaji": "Daburu Riichi",
      "mjai": "double_reach",
      "closed_only": true,
      "open_en": null,
      "open_ja": null,
      "value": { "unit": "han", "closed": 2, "open": null }
    },
    {
      "kind": "Unbroken",
      "en": "Unbroken",
      "ja": "一発",
      "romaji": "Ippatsu",
      "mjai": "ippatsu",
      "closed_only": true,
      "open_en": null,
      "open_ja": null,
      "value": { "unit": "han", "closed": 1, "open": null }
    },
    {
      "kind": "FullyConcealedHand",
      "en": "Fully Concealed Hand",
      "ja": "門前清自摸和",
      "romaji": "Menzen Tsumo",
      "mjai": "menzenchin_tsumoho",
      "closed_only": true,
      "open_en": null,
      "open_ja": null,
      "value": { "unit": "han", "closed": 1, "open": null }
    },
    {
      "kind": "SevenPairs",
      "en": "Seven Pairs",
      "ja": "七対子",
      "romaji": "Chiitoitsu",
      "mjai": "chitoitsu",
      "closed_only": true,
      "open_en": null,
      "open_ja": null,
      "value": { "unit": "han", "closed": 2, "open": null }
    },
    {
      "kind": "NagashiMangan",
      "en": "Nagashi Mangan",
      "ja": "流し満貫",
      "romaji": "Nagashi Mangan",
      "mjai": "nagashimangan",
      "closed_only": false,
      "open_en": null,
      "open_ja": null,
      "value": { "unit": "mangan" }
    },
    {
      "kind": "LastTileDraw",
      "en": "Last Tile Draw",
      "ja": "海底撈月",
      "romaji": "Haitei",
      "mjai": "haiteiraoyue",
      "closed_only": false,
      "open_en": null,
      "open_ja": null,
      "value": { "unit": "han", "closed": 1, "open": 1 }
    },
    {
      "kind": "LastTileClaim",
      "en": "Last Tile Claim",
      "ja": "河底撈魚",
      "romaji": "Hōtei",
      "mjai": "hoteiraoyui",
      "closed_only": false,
      "open_en": null,
      "open_ja": null,
      "value": { "unit": "han", "closed": 1, "open": 1 }
    },
    {
      "kind": "AfterAQuad",
      "en": "After a Quad",
      "ja": "嶺上開花",
      "romaji": "Rinshan Kaihō",
      "mjai": "rinshankaiho",
      "closed_only": false,
      "open_en": null,
      "open_ja": null,
      "value": { "unit": "han", "closed": 1, "open": 1 }
    },
    {
      "kind": "RobbingAQuad",
      "en": "Robbing a Quad",
      "ja": "搶槓",
      "romaji": "Chankan",
      "mjai": "chankan",
      "closed_only": false,
      "open_en": null,
      "open_ja": null,
      "value": { "unit": "han", "closed": 1, "open": 1 }
    },
    {
      "kind": "Pinfu",
      "en": "Pinfu",
      "ja": "平和",
      "romaji": "Pinfu",
      "mjai": "pinfu",
      "closed_only": true,
      "open_en": null,
      "open_ja": null,
      "value": { "unit": "han", "closed": 1, "open": null }
    },
    {
      "kind": "TwinSequences",
      "en": "Twin Sequences",
      "ja": "一盃口",
      "romaji": "Iipeikō",
      "mjai": "ipeko",
      "closed_only": true,
      "open_en": null,
      "open_ja": null,
      "value": { "unit": "han", "closed": 1, "open": null }
    },
    {
      "kind": "MixedSequences",
      "en": "Mixed Sequences",
      "ja": "三色同順",
      "romaji": "Sanshoku Dōjun",
      "mjai": "sanshokudojun",
      "closed_only": false,
      "open_en": "Mixed Sequences (Open)",
      "open_ja": "三色同順（鳴）",
      "value": { "unit": "han", "closed": 2, "open": 1 }
    },
    {
      "kind": "FullStraight",
      "en": "Full Straight",
      "ja": "一気通貫",
      "romaji": "Ikkitsūkan",
      "mjai": "ikkitsukan",
      "closed_only": false,
      "open_en": "Full Straight (Open)",
      "open_ja": "一気通貫（鳴）",
      "value": { "unit": "han", "closed": 2, "open": 1 }
    },
    {
      "kind": "DoubleTwinSequences",
      "en": "Double Twin Sequences",
      "ja": "二盃口",
      "romaji": "Ryanpeikō",
      "mjai": "ryanpeko",
      "closed_only": true,
      "open_en": null,
      "open_ja": null,
      "value": { "unit": "han", "closed": 3, "open": null }
    },
    {
      "kind": "AllTriplets",
      "en": "All Triplets",
      "ja": "対々和",
      "romaji": "Toitoi",
      "mjai": "toitoiho",
      "closed_only": false,
      "open_en": null,
      "open_ja": null,
      "value": { "unit": "han", "closed": 2, "open": 2 }
    },
    {
      "kind": "ThreeConcealedTriplets",
      "en": "Three Concealed Triplets",
      "ja": "三暗刻",
      "romaji": "San'ankō",
      "mjai": "sananko",
      "closed_only": false,
      "open_en": null,
      "open_ja": null,
      "value": { "unit": "han", "closed": 2, "open": 2 }
    },
    {
      "kind": "MixedTriplets",
      "en": "Mixed Triplets",
      "ja": "三色同刻",
      "romaji": "Sanshoku Dōkō",
      "mjai": "sanshokudoko",
      "closed_only": false,
      "open_en": null,
      "open_ja": null,
      "value": { "unit": "han", "closed": 2, "open": 2 }
    },
    {
      "kind": "AllInside",
      "en": "All Inside",
      "ja": "断么九",
      "romaji": "Tan'yao",
      "mjai": "tanyaochu",
      "closed_only": false,
      "open_en": null,
      "open_ja": null,
      "value": { "unit": "han", "closed": 1, "open": 1 }
    },
    {
      "kind": "ValueHonourSeatWind",
      "en": "Value Honour (seat wind)",
      "ja": "役牌（自風牌）",
      "romaji": "Yakuhai (jikaze)",
      "mjai": "jikaze",
      "closed_only": false,
      "open_en": null,
      "open_ja": null,
      "value": { "unit": "han", "closed": 1, "open": 1 }
    },
    {
      "kind": "ValueHonourRoundWind",
      "en": "Value Honour (round wind)",
      "ja": "役牌（場風牌）",
      "romaji": "Yakuhai (bakaze)",
      "mjai": "bakaze",
      "closed_only": false,
      "open_en": null,
      "open_ja": null,
      "value": { "unit": "han", "closed": 1, "open": 1 }
    },
    {
      "kind": "ValueHonourWhiteDragon",
      "en": "Value Honour (White dragon)",
      "ja": "役牌（白）",
      "romaji": "Yakuhai (haku)",
      "mjai": "sangenpai",
      "closed_only": false,
      "open_en": null,
      "open_ja": null,
      "value": { "unit": "han", "closed": 1, "open": 1 }
    },
    {
      "kind": "ValueHonourGreenDragon",
      "en": "Value Honour (Green dragon)",
      "ja": "役牌（發）",
      "romaji": "Yakuhai (hatsu)",
      "mjai": "sangenpai",
      "closed_only": false,
      "open_en": null,
      "open_ja": null,
      "value": { "unit": "han", "closed": 1, "open": 1 }
    },
    {
      "kind": "ValueHonourRedDragon",
      "en": "Value Honour (Red dragon)",
      "ja": "役牌（中）",
      "romaji": "Yakuhai (chun)",
      "mjai": "sangenpai",
      "closed_only": false,
      "open_en": null,
      "open_ja": null,
      "value": { "unit": "han", "closed": 1, "open": 1 }
    },
    {
      "kind": "CommonEnds",
      "en": "Common Ends",
      "ja": "混全帯么九",
      "romaji": "Chanta",
      "mjai": "honchantaiyao",
      "closed_only": false,
      "open_en": "Common Ends (Open)",
      "open_ja": "混全帯么九（鳴）",
      "value": { "unit": "han", "closed": 2, "open": 1 }
    },
    {
      "kind": "PerfectEnds",
      "en": "Perfect Ends",
      "ja": "純全帯么九",
      "romaji": "Junchan",
      "mjai": "junchantaiyao",
      "closed_only": false,
      "open_en": "Perfect Ends (Open)",
      "open_ja": "純全帯么九（鳴）",
      "value": { "unit": "han", "closed": 3, "open": 2 }
    },
    {
      "kind": "CommonTerminals",
      "en": "Common Terminals",
      "ja": "混老頭",
      "romaji": "Honrōtō",
      "mjai": "honroto",
      "closed_only": false,
      "open_en": null,
      "open_ja": null,
      "value": { "unit": "han", "closed": 2, "open": 2 }
    },
    {
      "kind": "LittleDragons",
      "en": "Little Dragons",
      "ja": "小三元",
      "romaji": "Shōsangen",
      "mjai": "shosangen",
      "closed_only": false,
      "open_en": null,
      "open_ja": null,
      "value": { "unit": "han", "closed": 2, "open": 2 }
    },
    {
      "kind": "ThreeQuads",
      "en": "Three Quads",
      "ja": "三槓子",
      "romaji": "Sankantsu",
      "mjai": "sankantsu",
      "closed_only": false,
      "open_en": null,
      "open_ja": null,
      "value": { "unit": "han", "closed": 2, "open": 2 }
    },
    {
      "kind": "CommonFlush",
      "en": "Common Flush",
      "ja": "混一色",
      "romaji": "Hon'itsu",
      "mjai": "honiso",
      "closed_only": false,
      "open_en": "Common Flush (Open)",
      "open_ja": "混一色（鳴）",
      "value": { "unit": "han", "closed": 3, "open": 2 }
    },
    {
      "kind": "PerfectFlush",
      "en": "Perfect Flush",
      "ja": "清一色",
      "romaji": "Chin'itsu",
      "mjai": "chiniso",
      "closed_only": false,
      "open_en": "Perfect Flush (Open)",
      "open_ja": "清一色（鳴）",
      "value": { "unit": "han", "closed": 6, "open": 5 }
    },
    {
      "kind": "ThirteenOrphans",
      "en": "Thirteen Orphans",
      "ja": "国士無双",
      "romaji": "Kokushi Musō",
      "mjai": "kokushimuso",
      "closed_only": true,
      "open_en": null,
      "open_ja": null,
      "value": { "unit": "yakuman", "closed": 1, "open": null }
    },
    {
      "kind": "ThirteenOrphansThirteenWait",
      "en": "Thirteen Orphans (13-sided wait)",
      "ja": "国士無双十三面待ち",
      "romaji": "Kokushi Musō jūsanmen machi",
      "mjai": "kokushimuso",
      "closed_only": true,
      "open_en": null,
      "open_ja": null,
      "value": { "unit": "yakuman", "closed": 1, "open": null },
      "double_yakuman_option": true
    },
    {
      "kind": "FourConcealedTriplets",